uri,title,isco_code,description,num_essential_skills,num_optional_skills
http://data.europa.eu/esco/occupation/fc35b7ca-ecec-40d7-91b5-5065f662d955,airport director,1324,"Airport directors oversee a group of managers who lead or supervise a particular area of the airport, programme or a project.\
",23,8
http://data.europa.eu/esco/occupation/a79170ad-0b7b-4697-864f-1748359aa10a,ICT product manager,1330,"ICT product managers analyse and define current and target status for ICT products, services or solutions. They estimate the cost effectiveness, points of risk, opportunities, strengths and weaknesses of products or services provided. ICT product managers create structured plans and establish time scales and milestones, ensuring optimisation of activities and resources.",22,26
http://data.europa.eu/esco/occupation/3ce4691e-ecea-4278-939e-b89ab01087b8,telecommunications manager,1330,"Telecommunications managers coordinate telecommunications staff activities for installing, troubleshooting, repairing and maintaining telecommunications equipment and infrastructure. They oversee the research, evaluation and implementation of new technologies and ensure a safe working environment for the employees. They supervise the inventory of supplies as well as user and customer assistance actions.",10,16
http://data.europa.eu/esco/occupation/50760da6-abc3-424c-b159-8ddf0818e016,business valuer,2412,"Business valuers provide valuation assessements of business entities, stock and other securities and intangible assets, in order to assist their clients in strategic decision-making procedures such as mergers and acquisitions, litigation cases, bankruptcy, taxation compliance and general restructuring of the companies.",17,22
http://data.europa.eu/esco/occupation/21de0f3b-a71a-4263-a9ba-90c5f3721b4d,financial planner,2412,"Financial planners assist people dealing with various personal financial issues. They are specialised in financial planning, such as retirement planning, investment planning, risk management and insurance planning, and tax planning. They advise a strategy tailored to the client's needs. They ensure the accuracy of bank and other financial records while maintaining a customer-orientated approach and following ethical standards.",23,44
http://data.europa.eu/esco/occupation/38d9c76b-1a7b-4d65-879b-733ae7e9364e,investment adviser,2412,"Investment advisers are professionals who offer transparent advice by recommending suitable solutions on financial matters to their clients. They advise on investing pension or free funds in securities such as stocks, bonds, mutual funds and exchange-traded funds to customers. Investment advisers serve individuals, households, families and owners of small companies.",22,20
http://data.europa.eu/esco/occupation/643a2225-6a01-4899-81b0-e867ca09b9c9,government planning inspector,2422,"Government planning inspectors monitor the development and implementation of government plans and policies, as well as processing planning and policy proposals, and performing inspections of planning procedures.",10,21
http://data.europa.eu/esco/occupation/7819669b-30c2-42e6-a1c4-0bcd6f0379ff,international relations officer,2422,"International relations officers ensure the development of cooperation between international public organisations and governments. They facilitate communication between their organisation and foreign organisations and develop collaboration strategies, promoting a collaborative relationship beneficial for both parties.",10,20
http://data.europa.eu/esco/occupation/e5a63940-57d3-4065-8713-74b4e2c93063,product and services manager,2431,Product and services managers are in charge of defining the content and structure of a catalogue or portfolio within a company.,18,7
http://data.europa.eu/esco/occupation/c2e6609d-0abe-4a38-b295-e06edbd52e82,fundraising manager,2432,"
Fundraising managers are responsible for raising money on behalf of organisations, often non-profit such as charities. Moreover, they manage the fundraised resources developing programs for its use. They perform a variety of tasks to raise money such as developing corporate partnerships, coordinating direct mail campaigns, organizing fundraisers, contacting donators or sponsors, and sourcing grant income from trusts, foundations and other statutory bodies.",24,18
http://data.europa.eu/esco/occupation/903dc1bf-2da8-477d-83b2-687d360cf1da,intercultural communication consultant,2432,"Intercultural communication consultants specialise in social interaction between parties of different cultures, advise organisations on international interactions in order to optimise their performance, and facilitiate cooperation and positive interaction with organisations and individuals from other cultures.",14,23
http://data.europa.eu/esco/occupation/c0489e22-6a1b-4e52-974a-eb71bbb42134,public relations officer,2432,Public relations officers represent a company or organisation to stakeholders and the public. They use communications strategies to promote an understanding of the activities and image of their clients in a favourable way.,23,31
http://data.europa.eu/esco/occupation/246dda29-70f6-408b-b205-aa17b2ffb168,election observer,2619,Election observers are skilled and trained spectators of  the elections in a functioning democracy in order to enhance the transparency and credibility of the observed elections.,13,10
http://data.europa.eu/esco/occupation/7556c748-15b4-4e44-97d9-00d885d4cd7d,conservator,2621,"Conservators organise and valorise works of art, buildings, books and furniture. They work in a wide range of areas such as creating and implementing new collections of art, preserving heritage buildings by applying restoration techniques as well as foreseeing the conservation of literary works, films, and valuable objects.",14,18
http://data.europa.eu/esco/occupation/5727b567-993d-4d41-a13d-81a6af1a9a8e,social counsellor,2635,"Social counsellors provide support and guidance to individuals in the social work area, to help them solve specific problems in their personal life. It involves addressing personal and relationship issues, dealing with inner conflicts, crisis moments such as depression and addiction, in an attempt to empower individuals to achieve change and improve their life quality.",42,46
http://data.europa.eu/esco/occupation/4bef1707-a251-427e-9d8b-96595ec38d45,book editor,2641,Book editors find manuscripts that can be published. They review texts from writers to evaluate the commercial potential or they ask writers to take on projects that the publishing company wishes to publish. Book editors maintain good relationships with writers.,15,16
http://data.europa.eu/esco/occupation/9a2147aa-a72f-4f83-8653-c3f50d4e1e73,sign language interpreter,2643,Sign language interpreters understand and convert sign language into spoken language and vice versa. They maintain the nuances and the stress of the message in the recipient language.,11,14
http://data.europa.eu/esco/occupation/b2f5ed56-c83f-40d0-b861-f5253cd3d1d9,glass artist,2651,"Glass artists create original artworks by assembling pieces of glass. They can be involved in restoration processes (such as those going on in cathedrals, churches, etc.) and can create accessoires, windows or decorations.",16,8
http://data.europa.eu/esco/occupation/94d94bd0-9ac3-4bd8-81c0-c3fdf551aa16,sculptor,2651,"Sculptors may use a wide variety of materials to create sculptures, such as stone, clay, glass, wood, plaster, or any material of their choice. Those materials can be carved, modelled, moulded, cast, wrought, welded, and so on, in order to reach the desired shape.",12,6
http://data.europa.eu/esco/occupation/7beefadd-ea05-4f59-bc4b-01075f27b937,video artist,2651,"Video artists create videos using analogue or digital techniques to obtain special effects, animation, or other animated visuals using films, videos, images, computer or other electronic tools.",23,16
http://data.europa.eu/esco/occupation/d23fbcdc-d5e9-4724-a83f-99a0cfa8adb0,répétiteur,2652,"Répétiteurs accompany performers, usually singers, following the instructions of musical conductors in directing rehearsals and guiding the artists in the rehearsal process.",23,10
http://data.europa.eu/esco/occupation/ae73f0dc-05a7-4e23-a234-9bb7e6d86975,door to door seller,5243,Door to door sellers sell goods and services door to door.,20,10
http://data.europa.eu/esco/occupation/41beead9-98ad-4c89-b6e0-a14149f4eeab,fuel station specialised seller,5245,"Fuel station specialised sellers sell fuel, ​lubricating and cooling products for motor vehicles and motorcycles in a fuel station.",32,7
http://data.europa.eu/esco/occupation/3cc87d40-f402-4f57-9353-4b36a031cfc5,vehicle rental agent,5249," 
 Vehicle rental agents represent businesses involved in renting out vehicles and determine short periods of usage. They document transactions, insurances and payments. 
 
",23,17
http://data.europa.eu/esco/occupation/b2678105-9d5c-403f-b822-274aff706309,sheep breeder,6121,Sheep breeders oversee the production and day-to-day care of sheep. They maintain the health and welfare of sheep.,30,13
http://data.europa.eu/esco/occupation/7aedaa07-3884-4c5b-88f9-80997b2aa54b,welder,7212,"
Welders operate welding equipment in order to join metal workpieces together. They can use fusion welding processes based on different techniques and materials. They also perform simple visual inspection of welds.",31,47
http://data.europa.eu/esco/occupation/1a1ea837-0103-4230-8756-533a77c5f9f4,container equipment assembler,7213,Container equipment assemblers manufacture containers such as boilers or pressure vessels. They read blueprints and technical drawings to assemble parts and to build piping and fittings.,12,24
http://data.europa.eu/esco/occupation/ebe42b55-4801-493f-af18-04a35ebfbb9c,drilling machine operator,7223,"Drilling machine operators set up, program and control drilling machines, designed to drill holes in workpieces using a computer-controlled, rotary-cutting, multipointed cutting tool, inserted into the workpiece axially. They read drilling machine blueprints and tooling instructions, perform regular machine maintenance, and make adjustments to the drilling controls, such as the depth of drills or the rotation speed.",20,33
http://data.europa.eu/esco/occupation/5d46e448-b6bb-48e5-b245-5aad68e06085,oxy fuel burning machine operator,7223,"Oxy fuel burning machine operators set up and tend machines designed to cut, or rather burn off, excess material from the metal workpiece using a torch that heats the metal workpiece to its kindling temperature and subsequently burns it into a metal oxide upon its reaction with an emitted stream of oxygen, flowing out of the workpiece's created kerf as slag.",19,28
http://data.europa.eu/esco/occupation/3b4eb248-6b40-42fe-9d10-cba8ccfe6613,vehicle maintenance attendant,7231,"Vehicle maintenance attendants execute basic tasks such as changing oil, changing filters, changing spark plugs at a vehicle maintenance station.",13,12
http://data.europa.eu/esco/occupation/4ad4024e-d1d3-4dea-b6d1-2c7948111dce,vehicle technician,7231,"Vehicle technicians inspect, test and maintain vehicles, motorcycles, engine tune-ups and tyre replacements. They repair engine failures, lube replacements. Vehicle technicians replace vehicle components and evaluate warranty options. 
 
 ",34,31
http://data.europa.eu/esco/occupation/91373a70-79b6-47a2-aa50-07dfe20dd258,aircraft maintenance technician,7232,"Aircraft maintenance technicians perform preventive maintenance to aircrafts, aircrafts components, engines and assemblies, such as airframes and hydraulic and pneumatic systems. They perform inspections following strict protocols and aviation laws.",29,8
http://data.europa.eu/esco/occupation/6b46ea2f-403a-473c-b2e5-9fcf0c2bd634,fisheries assistant engineer,7233,"Fisheries assistant engineers assist the marine chief engineer with checking operations and maintenance of the propulsion plant, machinery and auxiliary equipment of the ship. They collaborate on security, survival and health care on board, observing the national and international standards of application.",14,6
http://data.europa.eu/esco/occupation/00c8d1cf-24f2-47d1-9f10-765e1c102811,land-based machinery technician,7233,"Land-based machinery technicians maintain, overhaul and repair agricultural equipment and machinery.",12,18
http://data.europa.eu/esco/occupation/2aa7fbbb-f06e-4454-8ff8-2d799e86ba51,textile machinery technician,7233,"Textile machinery technicians set up, maintain, inspect and repair mechanical and computer-controlled machinery used in textile manufacturing such as weaving, dyeing and finishing machines. 
 ",25,37
http://data.europa.eu/esco/occupation/06bd6285-13ed-4ea7-90cc-e9638a0600a9,automotive battery technician,7412,"Automotive battery technicians assemble, install, inspect, maintain and repair batteries in motor vehicles. They use electrical test equipment to confirm good working condition after installation. They evaluate batteries to determine the nature of power problems. They also prepare old batteries for disposal.",9,12
http://data.europa.eu/esco/occupation/9422c30d-c5ef-4fcc-a493-d67ee42189c0,marine electrician,7412,"Marine electricians install, maintain and repair electrical and electronic systems in vessels such as air conditioning systems, lamps, radios, heating systems, batteries, electrical wiring and alternators. They use diagnostic testing equipment to inspect vessels and find faults. To do repair work, they use hand tools and specialised electrical instruments and machines.",18,18
http://data.europa.eu/esco/occupation/b7aa4b4e-dbb6-4f58-b36c-35b9a7267972,computer hardware repair technician,7422,"Computer hardware repair technicians install, examine, test and repair computer hardware and peripheral components. They test computers' functionality, identify the problems and replace damaged components and parts.",18,20
http://data.europa.eu/esco/occupation/4542ff68-f809-4ba1-857c-fd26d0914eaa,dewatering technician,8111,"Dewatering technicians install and operate pumps, spares, pipe ranges, and vacuum dewatering systems to collect and remove liquids and chemicals.",8,9
http://data.europa.eu/esco/occupation/2a7d4b37-e831-4e20-827c-0682fe7e370e,pipeline pump operator,8113,"Pipeline pump operators tend pump equipment and systems to transfer liquids and substances (e.g. such as chemical solutions, crude oil, gases, and others) from one point to the next. They operate hoses, pumps, and other equipment according to the good to be transferred. They ensure smooth circulation and flow of the goods in the pipelines.",18,10
http://data.europa.eu/esco/occupation/8d3fd879-986d-42e7-bf67-c3c415592fe3,precast moulder,8114,"Precast moulders handcast decorative and structural concrete building products such as fireplace units, blocks or coloured tiles. They use a portable concrete-mixing machine.",10,10
http://data.europa.eu/esco/occupation/0477b9b0-8d2d-4eec-aaad-bac11092e98b,slate mixer,8114,Slate mixers operate and maintain slate mixing machines that mix multicolored slate granules used for asphalt-coated roofing felt surfacing.,8,4
http://data.europa.eu/esco/occupation/b322bb4c-bbef-45c2-bd7e-00a97c3ab268,rustproofer,8122,"Rustproofers use the proper equipment and machinery to provide metal workpieces with a hard, durable finishing coat, composed of specific chemical formulas, that prevents or delays iron and steel pieces from rusting and protects against corrosion.",15,30
http://data.europa.eu/esco/occupation/782ced63-e234-42a4-a7bd-a2d9a12ee61a,capsule filling machine operator,8131,Capsule filling machine operators control the filling of gelatine capsules with the specific medicinal preparations.,14,6
http://data.europa.eu/esco/occupation/daa6197d-dba6-49b5-8223-b31b7a126e4e,wax bleacher,8131,"Wax bleachers operate and maintain filter presses and tanks, used in wax bleaching, for candle production processes.",12,7
http://data.europa.eu/esco/occupation/7180a7be-68cd-4636-8c12-706722ad8862,photographic developer,8132,"Photographic developers use chemicals, instruments, and darkroom photographic techniques in specialised rooms in order to develop photographic films into visible images.",14,18
http://data.europa.eu/esco/occupation/b0c6f284-f3ed-4820-a62e-4e87869f5a3e,rubber products machine operator,8141,"Rubber products machine operators operate machines which knead, blend, calender, mould, extrude and cure rubber products from natural and synthetic rubber. They measure the ingredients for mixing and load them into the machine. Rubber products machine operators monitor and control the tempature, pressure and speed during production.",11,26
http://data.europa.eu/esco/occupation/65b88636-2ebb-4049-b509-2f6da5d6ea1c,envelope maker,8143,"Envelope makers tend a machine that takes in paper and executes the steps to creat envelopes: cut and fold the paper and glue it, then apply a weaker food-grade glue to the flap of the envelope for the consumer to seal it.",15,19
http://data.europa.eu/esco/occupation/06461fc3-1274-40a1-9322-dfc2753f5eea,spinning textile technician,8151,Spinning textile technicians perform operations related to setting up spinning processes.,5,5
http://data.europa.eu/esco/occupation/4c86c7c1-0839-456e-856f-65396d1f39d7,winding machine operator,8151,"Winding machine operators tend machines that wrap strings, cords, yarns, ropes, threads onto reels, bobbins, or spools. They handle materials, prepare them for processing, and use winding machines for the purpose. They also perform routine maintenance of the machinery.",14,17
http://data.europa.eu/esco/occupation/15502187-a1da-407a-843b-ce991d5f65fe,braiding machine operator,8159,"Braiding machine operators supervise the braiding process of a group of machines, monitoring fabric quality and braiding conditions. They inspect braiding machines after set up, start up, and during production to ensure the product being braided is meeting specs and quality standards.",12,3
http://data.europa.eu/esco/occupation/7dbb116c-a4e7-41e8-9f28-c8a738d93e28,beverage filtration technician,8160,"Beverage filtration technicians operate machines that clarify beverages prior to filtering. For the purpose, they transfer fermented beverages from settling casks into clarifying tanks and spreads chemicals over the surface of beverages to aid their clarification. Then, they pump beverages to transfer them to filtering tanks.",19,20
http://data.europa.eu/esco/occupation/5520bfd0-49d3-47e5-abe0-d72354711bc0,cacao beans cleaner,8160,"Cacao beans cleaners operate machines for the removal of foreign materials such as stones, string and dirt from cacao beans. They operate silos as to move beans from there to hoppers. They direct the cleaned beans to specified silos. They operate air-cleaning system in order to remove further foreign materials.",14,13
http://data.europa.eu/esco/occupation/0fdc5efb-d38e-4019-bede-0ce55404549d,candy machine operator,8160,"Candy machine operators tend machines that mix candy ingredients. They tend machines that weigh, measure, and mix ingredients. They form soft candies by spreading candy onto cooling and warming slabs cutting them manually or mechanically. They cast candies in moulds or by machine that extrudes candy. ",18,17
http://data.europa.eu/esco/occupation/2a2da883-8af5-4b98-832e-00e6681b22c3,chilling operator,8160,"Chilling operators perform various processes and tend specific machines for manufacturing prepared meals and dishes. They apply chilling, sealing, and freezing methods to foodstuffs for non-immediate consumption.",22,9
http://data.europa.eu/esco/occupation/9ae8251e-cb8e-4324-9d77-d967d43e6b46,fat-purification worker,8160," Fat-purification workers operate acidulation tanks and equipment that help with the separation of undesirable components from oils. 
",22,13
http://data.europa.eu/esco/occupation/3b46ee4d-a220-4c83-ad90-937456596889,kettle tender,8160,Kettle tenders operate machines that mix chewing gum base with sugar or sweetener. They follow procedures to place gum base in containers and then direct it to flow into mixers.,12,7
http://data.europa.eu/esco/occupation/b69d9b94-a40c-434d-af8f-e584257314f6,milk heat treatment process operator,8160,"Milk heat treatment process operators use equipments to perform different methods of pasteurisation and/or sterilisation to dairy liquid products. They operate equipment such as raw product booster pumps, homogenisers, flavour control equipment, clarifiers, separators, auxiliary pumps, and filters.",18,22
http://data.europa.eu/esco/occupation/9161b2df-624c-4f5e-ad6c-0392439fa5c3,starch extraction operator,8160," Starch extraction operators use equipment to extract starch from raw material such as corn, potatoes, rice, tapioca, wheat, etc. 
",25,10
http://data.europa.eu/esco/occupation/ca2da084-3bfa-47d8-84ba-ef890191708d,vermouth manufacturer,8160,"Vermouth manufacturers perform all the production processes required to produce vermouth. They mix ingredients and botanicals with wine and other spirits. They perform maceration, mixing and filtering of beverages together with the botanicals. Moreover, they manage the maturation of the beverages and forecast when the vermouth is ready for bottling.",16,10
http://data.europa.eu/esco/occupation/e19a0f13-da49-42cb-8b3a-27da8ce44c8c,glass forming machine operator,8181,"Glass forming machine operators operate and maintain machines that press or blow molten glass in moulds to form or shape products, such as neons, bottles, jars and drinking glasses. They set up and adjust machines, and weigh, measure and check production samples to check conformity to the set specifications.",17,22
http://data.europa.eu/esco/occupation/d9e4581a-91b3-47f9-a2d5-70eb542caac5,footwear finishing and packing operator,8183,"Footwear finishing and packing operators apply several techniques for assuring an appropriate final appearance of the packed pairs of footwear that are going to be sold. They perform according to the information received from their supervisor about the shoes that are going to be finished, about the means and materials to be used and the sequence of operations.",10,3
http://data.europa.eu/esco/occupation/2be85651-c94a-4531-9df8-3cc56932960e,heat sealing machine operator,8183,"Heat sealing machine operators operate sealing and gluing machines to join items together for further processing or to seal products or packages, using heat.",12,17
http://data.europa.eu/esco/occupation/976f752c-5f10-42ca-84fb-89aa529af04f,patient transport services driver,8322,"Patient transport services drivers transfer disabled, vulnerable and elderly patients to and from health care facilities such as hospitals or social care settings. They drive the ambulance and maintain all the related equipment but under non-emergency circumstances.",14,10
http://data.europa.eu/esco/occupation/1e9e18cb-80b6-4598-acdb-ae3b51047720,aircraft fuel system operator,8332,Aircraft fuel system operators maintain fuel distribution systems and ensure the refuelling of planes. ,10,2
http://data.europa.eu/esco/occupation/c5d779f4-345b-4918-872b-a1cbaeb1d9be,dangerous goods driver,8332,"Dangerous goods drivers transport fuel and bulk liquid, hazardous products and chemicals by road.",21,2
http://data.europa.eu/esco/occupation/eedbf8b1-9432-4f42-ab7f-db5cd3eb2a05,excavator operator,8342,"Excavator operators use excavators to dig into earth or other materials to remove it. They are involved in a variety of projects, such as demolition, dredging, and the of digging holes, foundations and trenches.",18,20
http://data.europa.eu/esco/occupation/b4f4b21e-7664-45ca-9697-9123cfd8c9ef,pile driving hammer operator,8342,Pile driving hammer operators work with a piece of heavy equipment that positions piles and hammers them into the ground using a rigging mechanism.,15,16
http://data.europa.eu/esco/occupation/1bcc6461-4cc2-4732-a6d0-901687046443,snow-clearing worker,8342,"Snow-clearing workers operate trucks and plows to remove snow and ice from public sidewalks, streets and other locations. They also dump salt and sand on the ground to de-ice the concerning locations.",11,9
http://data.europa.eu/esco/occupation/dc90cee4-bf4a-4d62-b729-faf49e62643e,container crane operator,8343,"Container crane operators operate electrically powered cranes equipped with cantilevers on which hoisting gear is supported to load or unload container cargo. They move towers in position alongside vessel and lower cantilevers over the deck or hold of a vessel. They lift and move container along the cantilever and position the container on the dock, on the vessel deck or in the hold.",14,8
http://data.europa.eu/esco/occupation/837502a6-57d9-4df4-903a-8a67dd53927f,engine minder,8350,Engine minders perform work related to the deck department of an inland water transport vessel. They use their experience on-board a motorised inland navigation vessel as an ordinary crewmember and have a basic knowledge of engines.,26,8
http://data.europa.eu/esco/occupation/503ea267-93e9-4b8c-ae5e-817fe7e4a245,street sweeper,9613,"Street sweepers operate sweeping equipment and machinery to remove waste, leaves or debris from streets. They maintain records of sweeping operations and maintain, clean and perform minor repairs to the equipment used.",13,13
http://data.europa.eu/esco/occupation/e31c83ac-cb74-4936-88f1-90ed0997b29b,amusement and recreation attendant,9629,"Amusement and recreation attendants perform a variety of attending duties at amusement or recreation facility. They may schedule the use of recreation facilities, maintain and provide equipment to participants of sporting events or recreational pursuits or operate amusement concessions and rides.",9,7
